timestamp,prolific_id,lesson,1,2,3,4,3r,4r,5,6,7,8,9,10,11,12,13,13r,14,15,15r,16,17,18,18r,19,20,21,22,23,24,25,enjoyment,competence,effort,value,open_feedback1,open_feedback2
6/19/2025 16:39:57,67e6bca1b98c613179d9c73e,3,7,7,1,1,6,6,7,7,6,7,7,7,7,7,1,6,7,1,6,7,6,1,6,7,7,7,6,7,7,7,6.57,6.83,6.40,6.86,I learnt and shared idea on how to keep tooth clean and free from dental problems.,the study has been very educative.
6/19/2025 16:41:15,60643e9b1b2e851ff9238862,3,6,6,2,2,5,5,6,6,5,5,5,6,6,7,2,5,5,2,5,5,7,1,6,7,7,7,6,6,7,7,5.57,5.67,5.60,6.71,"I enjoyed interacting with the chatbot, as it challenged me to articulate my views, and to think about why I had these conceptions about dental health. It was much more engaging than the other sections.",Thank you very much for giving me the opportinity to participate!
6/19/2025 16:46:00,6746c680672c3ab45f25efb7,0,6,5,2,1,5,6,6,6,3,5,4,6,6,6,2,5,6,1,6,1,7,6,1,7,7,7,7,7,7,7,5.29,5.33,4.20,7.00,"I liked it a lot. I experienced surprise, I was nearly confident that I was right about exercise helping with mental health so I was really surprised to read that it's not proven to help and might in fact make things worse.",none
6/19/2025 16:47:57,671d553e0d035028da7d29a1,1,7,7,2,1,5,6,6,7,7,6,5,6,7,6,2,5,5,2,5,5,6,3,4,1,7,7,7,5,2,7,6.43,5.83,5.00,5.14,"I enjoyed the essay task, but it was more exhaustive than the previous task. I feel like maybe providing some sort of goals/quests to achieve with the essay would help keep that gamified learning feeling from the previous task. (*Use two sources, *Include one statistic that impacted you)","This is pretty fun so far. If I'm right that this is a gamified learning platform, adding in a point system would be fun."
6/19/2025 16:51:19,67529d0aecb73bfe140d521f,0,6,6,3,2,4,5,5,5,4,5,5,5,5,5,5,2,5,2,5,5,5,5,2,5,5,5,5,6,5,5,5.00,4.50,4.40,5.14,"Well, I think I used a pretty solid system. And it has helped me build some solid conceptions.",You are doing a great job combating misinformation
6/19/2025 16:57:39,6746c680672c3ab45f25efb7,1,6,6,2,1,5,6,6,6,4,6,5,6,7,6,2,5,6,1,6,7,7,1,6,7,7,7,7,7,7,7,5.57,5.83,6.40,7.00,"I enjoyed it. I was surprised to read the argument supporting binge drinking being no big deal for healthy adults. The question asked if binge drinking COULD lead to serious and long term effects and that is true, it can. It doesn't mean it will but it can.",none
6/19/2025 17:04:39,5c5cad3e4ee81200018eafe2,0,7,6,1,1,6,6,7,7,7,5,4,5,6,6,1,6,7,1,6,7,7,1,6,7,7,7,7,7,7,7,6.57,5.33,6.60,7.00,Very smooth with no issues,
6/19/2025 17:08:37,67cb38c1c0710f1202158007,1,7,7,1,1,6,6,7,7,7,7,7,7,7,7,1,6,7,1,6,7,7,1,6,7,7,7,7,7,7,7,6.71,6.83,6.60,7.00,The system was easy to understand and encouraged me to consider both perspectives on binge drinking. It challenged my assumptions and presented thought-provoking arguments that really made me reflect.,I appreciate the engaging and balanced task. A brief summary at the end would help bring all the points together nicely.
6/19/2025 17:10:51,67529d0aecb73bfe140d521f,1,6,6,2,2,5,5,4,5,4,5,4,5,5,5,2,5,5,2,5,5,5,3,4,5,5,5,6,5,5,6,5.00,4.83,4.80,5.29,The system was solid and the transitioning was very seamless,You are doing a great job
6/19/2025 17:11:04,5c5cad3e4ee81200018eafe2,1,6,5,1,6,6,1,6,5,5,5,4,5,6,6,1,6,6,1,6,5,5,1,6,5,7,7,6,7,6,6,4.86,5.33,5.60,6.29,easy to read information and very factual,
6/19/2025 17:12:46,671d553e0d035028da7d29a1,3,7,7,1,1,6,6,7,7,6,6,5,7,7,6,1,6,5,1,6,5,7,2,5,7,7,7,7,7,7,7,6.57,6.17,5.60,7.00,"I really enjoyed chatting with Forty, but I wish there had been more back-and-fourth. After I stated my opinion and found evidence for my claim, Forty immediately moved on to another topic. I think a little more conversation on each topic would have been more helpful and made it much more interesting.","Thank you, this study was very entertaining AND interesting!!"
6/19/2025 17:30:43,67529d0aecb73bfe140d521f,3,6,6,2,2,5,5,6,6,4,6,5,5,4,4,2,5,6,1,6,5,5,2,5,6,6,5,6,6,6,6,5.43,4.83,5.40,5.86,"I think it was a pretty good system, and it was straight and easy to understand and navigate.","I really enjoyed being a part of this study, and I feel it will go a long way in combating misinformation."
6/19/2025 17:35:14,5c5cad3e4ee81200018eafe2,3,7,6,1,1,6,6,7,7,6,6,5,6,6,5,1,6,6,1,6,7,6,1,6,7,7,7,7,7,6,7,6.43,5.67,6.20,6.86,The opposing facts displayed made for an interesting argument but my opinion on the correctness of the initial statement didn't change. When searching I noticed that the opposing argument was one mainly put forward by dentists and dental practices who I consider would have a vested interest in opposing the initial argument due to more people needing their services as a consequence.,
6/19/2025 17:36:01,6746c680672c3ab45f25efb7,3,7,7,1,1,6,6,6,7,5,6,5,7,6,6,1,6,7,7,0,7,7,6,1,7,7,7,7,7,7,7,6.29,6.00,4.40,7.00,"I enjoyed the task, it reaffirmed what I already knew to be true and I learned a few things in the process.",none
6/19/2025 18:16:09,67cb38c1c0710f1202158007,3,7,7,1,1,6,6,7,7,7,7,7,7,7,7,7,0,7,1,6,7,7,1,6,7,7,7,7,7,7,7,6.71,5.83,6.60,7.00,"The system was easy to follow and clear. It helped me think more about dental care, especially balancing brushing with habits like flossing. Very informative.",Thanks for designing an engaging and thoughtful task. A brief summary at the end could help reinforce understanding and link the key points.
6/5/2025 22:38:28,65537e14439274fe5036b4d2,0,5,5,2,2,5,5,5,5,5,4,4,5,5,4,2,5,4,2,5,2,4,4,3,5,5,5,5,5,5,5,5.00,4.50,3.60,5.00,The AI made some interesting points and gave me alot to think about.,no
6/5/2025 21:59:40,5640c3ff074be600115e9e40,4,6,6,3,2,4,5,5,5,3,6,4,6,6,6,2,5,4,2,5,5,6,4,3,5,4,4,4,4,4,4,4.86,5.50,4.60,4.14,"I enjoyed talking to Forty, but it didn't seem to know what it's arguing position was supposed to be.",
6/5/2025 23:06:41,56f52b95298124000a8ef248,4,7,7,1,1,6,6,7,7,7,7,7,7,7,6,1,6,1,1,6,7,7,1,6,7,7,7,7,7,7,7,6.71,6.67,5.40,7.00,it provided adequate information,was a nice research
6/3/2025 21:34:16,5f9ac9de923dca223848cf19,4,6,6,1,1,6,6,6,6,5,6,4,6,6,6,1,6,6,1,6,6,7,2,5,6,6,6,5,6,6,6,5.86,5.67,6.00,5.86,I enjoyed using both systems and found the study very interesting.,"Good study, thank you."
6/5/2025 23:15:15,606721b3686a9cc96b3a93f2,4,6,6,1,1,6,6,6,6,5,6,6,6,6,6,1,6,7,1,6,7,7,1,6,7,6,6,5,6,6,6,5.86,6.00,6.60,6.00,I thought it went really well and I didn't have any issues with either system.,
6/5/2025 21:46:11,61071fd777b179d8bc84ed3f,4,7,7,1,1,6,6,7,7,7,7,7,7,7,7,1,6,7,1,6,7,7,1,6,7,7,7,7,7,7,7,6.71,6.83,6.60,7.00,the system was great overall really enjoyed it,no
6/5/2025 23:02:31,6128affc7322ddbb3e16dcb3,4,5,5,3,2,4,5,5,5,5,6,6,6,7,7,1,6,7,1,6,7,7,7,0,3,3,3,4,4,3,3,4.86,6.33,5.40,3.29,"The chatbot was frustrating because it would not change topics when I asked it to. Also, every time I sent a message, I was forced to the top of the chat and had to scroll down to where I actually was in the discussion which wasted time. Apart from that, it was intuitive and reacted in a way that was engaging",NA
6/3/2025 21:13:17,61656042f505fd7fa53e8628,4,7,7,1,1,6,6,7,7,5,4,5,5,4,4,4,3,4,1,6,7,7,1,6,5,6,6,7,5,5,5,6.43,4.17,6.00,5.57,no,
6/4/2025 18:57:38,6527fa167b587d5d0588ee51,4,7,7,1,1,6,6,7,7,6,6,6,6,7,6,1,6,7,1,6,7,7,1,6,7,7,7,7,7,7,7,6.57,6.17,6.60,7.00,System is easy to use.  Forty was friendly.,I enjoyed doing this and learned a lot from the resources I found.
6/5/2025 23:13:00,65537e14439274fe5036b4d2,4,5,5,2,2,5,5,5,5,5,5,5,5,5,5,5,2,5,2,5,5,5,2,5,5,5,5,5,5,5,5,5.00,4.50,5.00,5.00,The AI chat was the best,no
6/4/2025 3:21:28,6658b838fa019e8f175c7bf4,4,5,5,5,3,2,4,4,4,2,4,2,4,3,3,5,2,5,2,5,5,2,2,5,4,5,5,5,5,4,5,3.71,3.00,4.40,4.71,"I enjoyed the experience, I was hoping I could get more information before going ahead with the tasks but overall It was good.",Nothing further to add.
6/4/2025 18:54:41,66620b15d94e5cb49f62db0b,4,7,7,1,1,6,6,7,7,7,7,7,7,7,7,1,6,7,1,6,7,7,1,6,7,7,7,7,7,7,7,6.71,6.83,6.60,7.00,lovly,nil
6/5/2025 23:50:11,669fb915167d6c4b8e71dbfb,4,7,7,1,1,6,6,7,7,7,7,7,7,7,7,1,6,7,1,6,7,7,1,6,7,4,4,6,4,7,7,6.71,6.83,6.60,5.57,"MindFort’s approach seems to encourage critical thinking by challenging misconceptions, prompting deeper analysis, and guiding users toward evidence-based reasoning.",
6/5/2025 23:54:02,669fb915167d6c4b8e71dbfb,4,7,7,1,1,6,6,7,7,7,7,7,7,7,7,1,6,7,1,6,7,7,1,6,7,7,5,6,4,7,6,6.71,6.83,6.60,6.00,"MindFort’s approach seems to encourage critical thinking by challenging misconceptions, prompting deeper analysis, and guiding users toward evidence-based reasoning.",
6/5/2025 22:13:19,66abb1aea71eb1802eac060f,4,7,7,1,1,6,6,7,7,5,7,7,7,7,7,1,6,7,1,6,7,7,1,6,7,7,7,7,7,7,7,6.43,6.83,6.60,7.00,Its more of a technical issue and could be just my laptop but when the chatbot would respond it would scroll all the way to the top of the conversation which was confusing ,
6/4/2025 3:09:34,66b91ee649636fce844ef133,4,6,6,1,1,6,6,6,6,6,5,5,5,6,5,2,5,7,1,6,7,7,1,6,5,6,6,5,6,5,6,6.00,5.17,6.60,5.57,Overall I enjoyed the activity.  I think the Forty chat was a bit glitchy and more time consuming than it should have been due to the timer resetting every time I submitted a response.,Thank you! I hope to do more of these in the future!
6/5/2025 22:24:25,66fc401d58e0c0bccac3ad1c,4,7,7,1,1,6,6,7,7,7,7,7,7,7,7,1,6,7,1,6,7,7,1,6,7,7,7,7,7,7,7,6.71,6.83,6.60,7.00,"I thought the system with MindFort and Forty the chatbot was clear, engaging, and easy to follow. It made the learning process feel more conversational and less stressful. I liked how it encouraged me to think critically and reflect on common beliefs with evidence. Overall, it was a smooth and helpful experience.




",Thank you for the experience it was very fun.
6/4/2025 3:44:58,671139a20b977d78ec2ac1e0,4,7,7,1,1,6,6,7,7,1,7,4,6,6,5,1,6,7,7,0,6,7,1,6,7,7,7,7,7,7,7,5.86,5.67,5.20,7.00, no,no
6/4/2025 18:50:47,673741d5e8999c8a575d36b1,4,6,6,2,2,5,5,6,6,5,2,5,4,6,6,2,5,6,2,5,6,6,2,5,6,6,6,6,6,6,6,5.57,4.67,5.60,6.00,The chatbot was very knowledgeable and the system was easy to navigate,No
6/4/2025 18:11:54,674d7a89f564e8bbe0a7af1c,4,7,6,1,1,6,6,7,6,5,7,6,6,7,6,2,5,6,2,5,7,6,2,5,6,5,5,6,5,6,6,6.14,6.17,5.80,5.57,no,no
6/5/2025 22:13:44,67a7cee40b175c5c1991bbb1,4,7,7,1,1,6,6,7,7,6,7,6,7,7,7,1,6,7,1,6,7,7,1,6,7,7,7,6,6,7,7,6.57,6.67,6.60,6.71,"I thought the system was easy to use and pretty interesting. Chatting with Forty felt natural and made me think more about the topic. It wasn’t boring or one-sided, and I liked how it helped me see both arguments clearly. Overall, it was a good experience.",
6/4/2025 2:42:15,67a8dd65c1561d80783d7931,4,6,6,5,1,2,6,5,5,5,5,5,5,5,5,2,5,5,1,6,5,5,2,5,6,5,5,5,5,6,5,5.00,5.00,5.20,5.29,They prioritized clear and concise answers and maintain a friendly tone,
6/4/2025 18:41:15,67d390ad6655208f29df0d42,4,6,6,2,2,5,5,6,6,6,6,3,5,5,5,5,2,5,3,4,6,5,5,2,5,5,5,4,5,5,5,5.71,4.33,4.40,4.86,its easier to communicate with,
6/4/2025 18:31:07,6825b73a1e65510b29430c2b,4,7,7,1,1,6,6,7,7,7,7,7,7,7,7,1,6,7,1,6,7,7,1,6,7,7,7,7,7,7,7,6.71,6.83,6.60,7.00,"The system is easy to navigate, it's also appealing to the eyes.",
6/4/2025 18:58:16,68277ee28504bc466e88db4c,4,7,6,1,1,6,6,6,6,5,5,6,7,7,6,1,6,7,1,6,7,7,1,6,7,7,7,7,7,7,7,6.00,6.17,6.60,7.00,I had a very good experience with MindFort and Forty,The experiment was very educating.
6/4/2025 18:39:47,68290276545487fcb5250cd4,4,7,7,1,1,6,6,7,7,6,7,7,7,7,7,1,6,7,1,6,7,7,1,6,7,7,7,7,7,7,7,6.57,6.83,6.60,7.00,"The most interesting and significant aspect of the entire system, in my opinion, was the conversation with Forty the chatbot. It makes even more sense now that I know the objective was to investigate my resistance to persuasion, which is why it felt like a direct challenge.",The entire experiment was truly fascinating and extremely well-designed.
6/5/2025 22:14:07,682cd328bd53185cbbb59840,4,7,7,1,1,6,6,6,7,6,7,7,7,7,6,1,6,7,1,6,7,7,1,6,6,7,7,7,7,6,7,6.43,6.67,6.60,6.71,"I enjoyed interacting with forty, I was able to learn somethings on Dental hygiene that I was not aware of before",
6/3/2025 21:35:47,682ce55890f2f8f19e33469a,4,7,7,1,1,6,6,7,7,7,7,7,7,7,7,1,6,7,1,6,7,7,1,6,7,7,7,7,7,7,7,6.71,6.83,6.60,7.00," I found the system to be a well-designed for  experimental framework. The deliberate presentation of misinformation, followed by the debriefing, provided a unique and effective means to simulate real-world information challenges. From my perspective, the process of generating  responses to counter the provided arguments, even when knowing they were designed to be misleading, was a valuable exercise in reinforcing logical consistency and contextual understanding. The clarity of the debriefing was also crucial for understanding the underlying purpose of the varied information.",N/A
6/5/2025 23:09:00,682f83449466b61910a2684d,4,7,7,1,1,6,6,7,7,7,7,7,7,7,7,1,6,7,1,6,7,7,1,6,7,7,7,7,7,7,7,6.71,6.83,6.60,7.00,The engagement from the chatbot was really effective not only for reinforcing beliefs but also active learning.,"Discussing topics with Forty helped me understand and remember important points, especially when facing wrong ideas. I found it to be engaging and difficult in a good manner. Role-playing made the game more interesting to play. Thank you so much!"
6/4/2025 18:58:22,6834c332b2178abf4237097c,4,7,7,1,1,6,6,7,7,7,7,6,7,7,7,1,6,7,1,6,7,7,1,6,7,7,7,7,7,7,7,6.71,6.67,6.60,7.00,It was a great experience to use Forty and MindFort.,Very insightful pieces of information
6/6/2025 0:15:20,5b53e95f4bbe600001465c18,4,6,6,1,1,6,6,7,6,6,7,6,7,7,7,1,6,7,1,6,7,7,1,6,7,7,7,7,7,5,5,6.14,6.67,6.60,6.43,"I thought the system was easy to use. I liked chatting with Forty, I liked the way they presented an argument without being aggressive or making me feel like I was wrong. I liked how Forty kept encouraging me to find evidence on my own.",Very enjoyable experience! Thank you
6/6/2025 1:06:12,63d79fcd741f9cfb2f87152f,4,6,5,2,1,5,6,7,6,6,5,4,5,5,5,2,5,7,1,6,7,6,1,6,5,5,6,7,5,6,7,5.86,4.83,6.40,5.86,"I think it's important to have such systems especially with so much sources of fake news these days. However, for this system, it would be beneficial if the rankings of referenced websites are available to provide a level of confidence.",
6/6/2025 7:04:08,6522a42f39b5bd8f96735aa9,4,7,7,1,1,6,6,7,7,6,7,7,6,7,7,1,6,6,1,6,6,7,1,6,7,6,5,7,6,7,7,6.57,6.67,6.20,6.43,Convesation with the chatbot was very enjoyable and I had great time.,
6/18/2025 15:42:24,682669894da614d118d7a68e,4,6,5,6,1,1,6,6,2,6,5,7,6,5,6,1,6,7,1,6,7,6,1,6,6,6,4,6,3,6,6,4.57,5.83,6.40,5.29,It is knowledgable,
6/18/2025 15:51:03,682e4e90fa985e55c92c8c2c,4,7,7,1,1,6,6,7,7,7,7,7,7,7,7,1,6,7,1,6,7,7,1,6,7,7,7,7,7,7,7,6.71,6.83,6.60,7.00,"I enjoyed, the lessons were of great value",Thank you
6/18/2025 15:52:53,67d339b88129b9e57d6018f6,4,7,7,1,1,6,6,7,7,7,7,7,7,7,7,7,0,7,7,0,7,7,1,6,7,7,7,7,7,7,7,6.71,5.83,5.40,7.00,None,
6/18/2025 16:05:28,66d6376eb15526056851d558,4,7,7,1,1,6,6,7,7,5,6,5,6,6,6,1,6,6,1,6,6,6,1,6,6,6,6,7,6,6,6,6.43,5.83,6.00,6.14,"Please see my previous comments about the AI chatbot. I thought MindFort was intuitive to use...the only issue being after Lesson 1, I had some confusion thinking the code was to be entered on the Google screen, but then I figured out it was to be input on the bottom of the same MindFort screen! ",
6/18/2025 16:16:05,6830835595aaec2b12d334db,4,7,7,1,1,6,6,7,7,7,7,7,7,7,7,1,6,7,1,6,7,7,1,6,7,7,7,7,7,7,7,6.71,6.83,6.60,7.00,The system was great. I encountered no problems. I enjoyed chatting with Forty.,It was an informative study.
6/18/2025 16:19:56,6827250f5a993078e5866e46,4,7,7,1,1,6,6,7,7,7,7,7,7,7,7,1,6,7,1,6,7,7,1,6,7,7,7,7,7,7,7,6.71,6.83,6.60,7.00,This system was quite interesting to work with. It challenge my understanding of different concepts.,
6/18/2025 16:25:48,672e22142aab65aaeec4135f,4,6,7,2,1,5,6,6,7,6,7,7,6,7,7,1,6,7,2,5,6,7,1,6,7,7,7,7,7,7,7,6.14,6.67,6.20,7.00,well it was interactive and i felt important,
6/18/2025 16:31:03,6838e28aea059b7c0f7e2856,4,7,7,1,1,6,6,7,7,7,7,7,7,7,7,7,0,7,1,6,7,7,1,6,7,6,7,7,7,7,7,6.71,5.83,6.60,6.86,It’s been a fascinating ride engaging with MindFort and the character of Forty especially in the way the system encourages critical thinking through structured dialogue and opposition,
6/18/2025 16:44:41,63d7c195a5fb49d5a97bf7d5,4,6,6,6,1,1,6,6,6,5,5,5,6,6,5,1,6,5,1,6,6,6,1,6,6,6,6,6,6,6,6,5.14,5.50,5.80,6.00,"MindFort was easy to use and felt like it Gamified the study which made it more interesting and I wanted to continue and move onto the next stage. Forty was also fun to talk to, the only thing is I felt like it wanted to end the conversation sooner than I would have liked. It also encouraged me to do the research myself on my computer rather than telling me the information itself.",Thanks for an enjoyable study
6/18/2025 16:49:52,67dd4262a42caa45036e811a,4,7,7,1,1,6,6,7,7,5,7,7,7,7,7,1,6,7,1,6,6,7,1,6,6,7,7,7,7,7,7,6.43,6.83,6.40,6.86,I liked them all. They were easy to use.,NIL
6/18/2025 16:56:31,67d26cafd23cded4011396a0,4,6,6,5,4,2,3,6,6,5,6,6,5,5,6,4,3,6,5,2,5,6,6,1,6,6,5,6,6,5,6,4.86,5.17,4.00,5.71,"Very great, i love it",
6/18/2025 17:13:11,663abe859bcc3ea8ef9bbdf3,4,7,7,1,1,6,6,7,7,7,7,6,7,7,6,1,6,7,1,6,7,7,1,6,7,7,7,7,7,7,7,6.71,6.50,6.60,7.00,The entire experience was great. I'd learned a lot about how misinformation could present itself as facts.,
6/18/2025 17:23:37,67e6b4c78b8b457f3bc6a866,4,7,7,1,1,6,6,7,7,7,7,7,7,7,7,1,6,7,1,6,7,7,1,6,7,7,7,7,7,7,7,6.71,6.83,6.60,7.00,i felt positive towards the system i just used,the study went well
6/18/2025 17:24:20,62ebd3cd785939570957fe59,4,7,7,1,1,6,6,7,7,6,7,7,7,7,6,1,6,7,1,6,7,7,1,6,7,7,7,7,7,7,7,6.57,6.67,6.60,7.00,This was a good way of educating myself,
6/18/2025 17:47:32,66c23cc4a330eb2fec13fc2a,4,7,7,2,2,5,5,6,6,7,6,5,6,6,6,1,6,6,1,6,6,6,1,6,7,7,6,7,6,6,7,6.14,5.83,6.00,6.57,"MindFort was kinda helpful, made me think more about stuff. Forty was cool, easy to talk with, and had good info. Sometimes felt a bit robotic but still okay. No big feelings, just normal.",no
6/18/2025 17:53:32,67e41e22f1276be3fc922e8e,4,7,7,1,1,6,6,7,6,7,6,6,7,7,7,1,6,7,1,6,7,7,1,6,6,6,6,7,6,7,7,6.57,6.50,6.60,6.43,The system is effective and efficient,The study was interesting
6/18/2025 18:45:57,669284eabea5b8c9655927da,4,7,7,1,1,6,6,7,7,7,7,4,7,7,5,1,6,7,1,6,7,7,1,6,7,7,7,7,7,7,7,6.71,6.00,6.60,7.00,I liked the chatbox the most it felt the most interactive and I learned the most from it. I think teaching through chatbox truly is the future in my opinion.,Thank you so so much I learned quite a lot. It's an honor to be apart pf this study. Have a great rest of your day!
6/19/2025 16:06:18,6123c6bc3055eec90f7dbabb,4,2,2,3,4,4,3,4,3,3,4,4,4,4,4,3,4,4,4,3,3,4,4,3,5,6,6,7,6,6,6,3.00,4.00,3.40,6.00,The chatbot seemed unnatural and was a bit awkward to use.,
6/19/2025 16:18:01,664070b4d08d92e1c904a1e8,4,6,5,2,2,5,5,5,6,4,5,6,7,6,6,2,5,6,6,1,6,5,2,5,5,6,6,5,6,6,6,5.14,5.83,4.60,5.71,I thought it was easy and quite fun to use. I learned a lot thanks to the way it was designed (Mindfort and Forty the chatbox). The fonts were aesthetically appealing and made me engaged more than other surveys.,
6/19/2025 16:33:58,678f0bb28ec3307e4f1afb78,4,6,6,2,2,5,5,6,6,5,6,6,6,6,6,2,5,6,2,5,6,6,2,5,6,6,6,6,6,6,6,5.57,5.83,5.60,6.00,no,no
6/19/2025 16:34:49,67eee9e1498801a1f32dc1dd,4,6,6,1,1,6,6,6,6,5,6,6,6,6,6,1,6,7,1,6,7,6,1,6,7,6,7,6,6,6,7,5.86,6.00,6.40,6.43,The system was easy to navigate,
6/19/2025 16:36:40,683cccb8b33df566dc27c902,4,6,6,6,1,1,6,6,6,6,7,6,5,5,6,1,6,6,1,6,6,6,1,6,6,7,6,6,5,5,6,5.29,5.83,6.00,5.86,Forty was knowledgeble,
6/19/2025 16:38:22,6830a65545c6acade46a1d0a,4,6,6,1,2,6,5,6,6,7,6,6,6,6,6,1,6,6,4,3,5,6,6,1,6,6,6,6,6,6,6,6.00,6.00,4.20,6.00,it was educating,interesting
6/19/2025 16:39:03,67d7598ad9aacf9073ca130d,4,6,6,1,1,6,6,7,6,6,6,4,6,6,6,1,6,6,1,6,6,6,1,6,7,7,6,7,7,7,7,6.14,5.67,6.00,6.86,Pretty straightforward system...easy to use. The AI chatbot was very interactive ,
6/19/2025 16:41:15,67edb9ee77a87b53846a8aa8,4,7,7,1,1,6,6,7,7,7,7,7,7,7,7,1,6,7,1,6,7,7,1,6,7,7,7,7,7,7,7,6.71,6.83,6.60,7.00,I liked both. Forty had good suggestions about the topic and directed me where to search for information. MindFort is seamless. I'd be happy to learn more about it.,N/A
6/19/2025 16:44:16,60643e9b1b2e851ff9238862,4,5,6,2,2,5,5,5,6,6,5,5,6,6,7,1,6,5,2,5,5,7,6,1,6,7,7,6,7,6,7,5.43,5.83,4.60,6.57,"I felt that the chatbot was providing misinformation, and then the following article cited some unreliable sources (and perhaps overstated the points).",Thank you very much!
6/19/2025 16:44:48,67e6bca1b98c613179d9c73e,4,7,7,1,1,6,6,7,7,7,7,7,7,7,7,7,0,7,1,6,7,7,1,6,7,7,7,7,7,7,7,6.71,5.83,6.60,7.00,I experienced the beauty of learning in the four lessons presented as well as sharing my ideas on what I think about each topic.,the experiment is educative and engaging.
6/19/2025 17:18:02,671d553e0d035028da7d29a1,4,7,7,1,1,6,6,7,7,7,7,7,7,7,7,1,6,6,1,6,6,7,2,5,7,7,7,7,7,7,7,6.71,6.83,6.00,7.00,"I just want to say that I really enjoyed this study! The experiment was set up in such a way that it really held my attention and was entertaining. I found myself looking forward to the next tasks. Now that I've read the debrief, I feel a little relieved that I wasn't wrong, but on #3 and #4 I did lose a little confidence in my belief when presented with opposing information. ",Thank you again! 
6/19/2025 17:33:50,67529d0aecb73bfe140d521f,4,6,6,2,2,5,5,5,5,4,6,5,5,4,5,2,5,5,2,5,4,5,2,5,5,5,5,5,5,5,5,5.14,5.00,4.80,5.00,"It was solid, easy to navigate and enlightening.",This experiment was very enjoyably and enlightning.
6/19/2025 17:38:58,5c5cad3e4ee81200018eafe2,4,7,6,1,1,6,6,7,7,7,6,5,7,7,6,1,6,7,1,6,7,7,1,6,7,7,7,7,7,7,7,6.57,6.17,6.60,7.00,A very good system that was easy to use. Everything was well laid out and the instructions were clear. I enjoyed the chat with Forty very much.,"This was a very interesting and enjoyable study to do, thank you for the opportunity to take part."
6/19/2025 17:39:24,6746c680672c3ab45f25efb7,4,7,7,1,1,6,6,7,7,5,7,7,7,7,7,1,6,7,1,6,7,7,7,0,7,7,7,7,7,7,7,6.43,6.83,5.40,7.00,"I loved it, I think a lot of people can benefit from using a system like this because it will force them to either prove their own ideas or debunk themselves. ","this was fun, would love to see one of these for political issues. "
6/19/2025 18:22:19,67cb38c1c0710f1202158007,4,7,7,1,1,6,6,7,7,7,7,7,7,7,7,1,6,7,1,6,7,7,1,6,7,7,7,7,7,7,7,6.71,6.83,6.60,7.00,"The system was simple to use and intuitive, in my opinion. Forty, the chatbot, was interesting and helpful; it made me think more deeply than I had anticipated.",It went well and I enjoyed it!
6/5/2025 22:14:58,682f47a03095562bd581bd06,4,6,7,2,1,5,6,7,6,6,7,6,6,7,6,2,5,6,1,6,7,6,2,5,6,6,6,7,6,6,6,6.14,6.17,6.00,6.14,No,
