timestamp,prolific_id,lesson,1,2,3,4,3r,4r,5,6,7,8,9,10,11,12,13,13r,14,15,15r,16,17,18,18r,19,20,21,22,23,24,25,enjoyment,competence,effort,value,open_feedback1,open_feedback2
6/4/2025 18:46:48,673741d5e8999c8a575d36b1,3,6,6,2,1,5,6,6,6,5,6,5,6,6,6,2,5,6,2,5,6,6,2,5,5,5,5,6,5,5,5,5.71,5.67,5.60,5.14,It was easy and the AI answered very quickly and informatively,No
6/4/2025 17:50:12,674d7a89f564e8bbe0a7af1c,1,6,3,1,1,6,6,7,6,4,7,6,7,7,6,1,6,6,1,6,5,7,1,6,6,5,5,6,6,6,7,5.43,6.50,6.00,5.86,no,no
6/4/2025 18:09:53,674d7a89f564e8bbe0a7af1c,3,7,2,1,1,6,6,7,7,5,7,6,6,7,6,2,5,6,2,5,6,7,2,5,6,6,5,7,6,6,7,5.71,6.17,5.80,6.14,no,no
6/5/2025 21:17:01,67a7cee40b175c5c1991bbb1,1,7,6,1,1,6,6,7,6,4,7,6,7,6,7,1,6,7,1,6,7,7,1,6,7,7,6,6,7,6,7,6.00,6.50,6.60,6.57,The system was clear and easy to use. It presented the information in a thoughtful way and encouraged reflection without pressure.,I enjoyed taking part in this.
6/5/2025 21:47:15,67a7cee40b175c5c1991bbb1,3,7,7,1,1,6,6,7,7,4,7,6,7,7,7,1,6,7,1,6,7,7,1,6,7,7,7,7,7,7,7,6.29,6.67,6.60,7.00,"The system was clear, easy to follow, and encouraged thoughtful reflection. It was helpful to see different perspectives and think critically about real-world issues like environmental protection.",
6/5/2025 21:49:20,67a7cee40b175c5c1991bbb1,3,7,7,1,1,6,6,7,7,4,7,6,7,7,7,1,6,7,1,6,7,7,1,6,7,4,7,7,4,7,5,6.29,6.67,6.60,5.86,"The system was clear, easy to follow, and encouraged thoughtful reflection. It was helpful to see different perspectives and think critically about real-world issues like environmental protection.",
6/5/2025 21:51:27,67a7cee40b175c5c1991bbb1,3,7,7,1,1,6,6,7,7,7,7,6,6,7,7,1,6,7,1,6,7,7,1,6,7,7,7,7,7,7,7,6.71,6.50,6.60,7.00,"The system was clear, easy to follow, and encouraged thoughtful reflection. It was helpful to see different perspectives and think critically about real-world issues like environmental protection.",
6/5/2025 22:09:44,67a7cee40b175c5c1991bbb1,3,7,7,1,1,6,6,7,7,5,7,7,7,7,7,1,6,7,1,6,7,7,1,6,7,7,6,7,7,7,7,6.43,6.83,6.60,6.86,The system was easy to use and made the topic clear and engaging. It helped me think more deeply about dental hygiene and gave useful information to challenge common myths.,
6/5/2025 22:11:29,67a7cee40b175c5c1991bbb1,3,7,7,1,1,6,6,7,7,7,7,6,7,7,7,1,6,7,1,6,7,7,1,6,7,6,6,7,6,7,7,6.71,6.67,6.60,6.57,The system was easy to use and made the topic clear and engaging. It helped me think more deeply about dental hygiene and gave useful information to challenge common myths.,
6/4/2025 2:08:52,67a8dd65c1561d80783d7931,0,5,5,5,1,2,6,5,4,5,5,5,5,5,5,2,5,5,1,6,6,6,1,6,6,6,6,6,6,6,7,4.57,5.00,5.80,6.14,Not that I know of,no
6/4/2025 2:21:14,67a8dd65c1561d80783d7931,0,6,4,2,1,5,6,6,6,4,6,6,6,6,6,1,6,6,2,5,5,5,2,5,6,6,7,7,7,7,7,5.29,6.00,5.20,6.71,"Nothing, everything was perfect",Everything went well
6/4/2025 3:05:33,67a8dd65c1561d80783d7931,0,6,6,6,6,1,1,6,6,7,6,6,6,6,6,1,6,6,1,6,6,6,2,5,6,6,6,6,6,6,6,4.71,6.00,5.80,6.00,No,No
6/4/2025 2:38:12,67a8dd65c1561d80783d7931,1,7,7,3,1,4,6,6,5,5,5,5,5,6,5,1,6,6,1,6,4,6,1,6,6,6,6,6,6,5,6,5.71,5.33,5.60,5.86,None,None
6/4/2025 2:47:21,67a8dd65c1561d80783d7931,3,6,6,1,1,6,6,6,6,6,6,6,6,6,6,1,6,6,1,6,6,7,1,6,7,7,6,7,6,6,6,6.00,6.00,6.20,6.43,No,No
6/4/2025 17:40:20,67d390ad6655208f29df0d42,0,6,6,2,1,5,6,6,6,6,6,3,5,5,4,3,4,5,2,5,6,6,2,5,5,6,5,4,5,5,5,5.86,4.50,5.40,5.00,yes have learned a lot and challenged my perspectives,no
6/4/2025 17:55:29,67d390ad6655208f29df0d42,1,6,6,6,5,1,2,6,6,5,7,6,5,5,6,3,4,6,5,2,5,5,3,4,5,5,5,5,5,5,6,4.57,5.50,4.40,5.14,yes reminded me once I crushed my parent's car after binge drinking,no
6/4/2025 18:37:06,67d390ad6655208f29df0d42,3,6,3,1,2,6,5,5,5,5,3,3,5,3,3,3,4,5,2,5,5,5,5,2,3,5,5,6,5,5,6,5.00,3.50,4.40,5.00,it was good challenging my knowledge,no
6/4/2025 17:38:52,6825b73a1e65510b29430c2b,0,7,7,1,1,6,6,7,7,7,7,7,7,7,7,1,6,7,1,6,7,7,1,6,7,7,7,7,7,7,7,6.71,6.83,6.60,7.00,"Yes, it's simple to navigate, and appealing.",
6/4/2025 17:41:33,6825b73a1e65510b29430c2b,0,7,7,1,1,6,6,7,7,7,7,7,7,7,7,1,6,7,1,6,7,7,1,6,7,7,7,7,7,7,7,6.71,6.83,6.60,7.00,It's very easy to navigate.,
6/4/2025 18:10:04,6825b73a1e65510b29430c2b,1,7,7,1,1,6,6,7,7,7,7,7,7,7,7,1,6,7,1,6,7,7,1,6,7,7,7,7,7,7,7,6.71,6.83,6.60,7.00,It's fun to chat with.,
6/4/2025 18:27:38,6825b73a1e65510b29430c2b,3,7,7,1,1,6,6,7,7,7,7,7,7,7,7,1,6,7,1,6,7,7,1,6,7,7,7,7,7,7,7,6.71,6.83,6.60,7.00,The system is easy to navigate.,
6/4/2025 17:53:00,68290276545487fcb5250cd4,1,6,6,1,1,6,6,7,6,5,6,6,7,7,6,1,6,6,1,6,6,6,1,6,7,7,7,7,7,7,7,6.00,6.33,6.00,7.00,The system itself was simple to use and intuitive. The task of refuting the statements was interesting to me.,I truly value how this study is structured to educate people about health and how to recognize false information.
6/4/2025 18:23:49,68290276545487fcb5250cd4,3,6,5,1,1,6,6,7,6,5,6,6,6,6,6,1,6,5,1,6,5,6,1,6,7,7,7,7,7,7,7,5.86,6.00,5.60,7.00,This portion of the system was simple and primarily consisted of reading. It was intriguing to observe how the text that attempted to refute environmental protection was presented after the data that supported it,"This reading-only format was somewhat less interactive than the chatbot-based previous lesson, but it served the same objective"
6/4/2025 18:34:02,68290276545487fcb5250cd4,3,5,6,1,1,6,6,6,5,4,6,5,6,6,6,1,6,5,1,6,5,6,1,6,7,7,7,7,7,7,7,5.43,5.83,5.60,7.00,"Since there was no active argument phase in this last lesson, it felt a little different. The majority of it was reading and restating my position, despite the text's attempt to imply that brushing every day wasn't always necessary","All things considered, this MindFort experiment has been incredibly interesting and thought-provoking"
6/5/2025 21:24:12,682cd328bd53185cbbb59840,0,6,7,1,1,6,6,6,7,4,6,7,7,7,6,1,6,7,1,6,7,7,1,6,6,7,7,7,7,6,7,6.00,6.50,6.60,6.71,I think it is very informative and useful in creating awareness on the relationship between physical activities and mental health. I enjoyed reading the essays.,
6/5/2025 21:44:26,682cd328bd53185cbbb59840,1,6,6,2,2,5,5,5,6,2,6,7,7,7,6,2,5,7,1,6,7,7,1,6,6,7,7,7,7,6,7,5.00,6.33,6.60,6.71,"No, I enjoyed doing the research on the topic and the information I got was very enlightening",No
6/5/2025 22:10:11,682cd328bd53185cbbb59840,3,7,7,1,1,6,6,6,7,6,7,7,7,7,6,1,6,7,1,6,7,7,1,6,7,7,7,7,7,7,7,6.43,6.67,6.60,7.00,I enjoyed the activity especially chatting with the bot,
6/3/2025 20:51:46,682ce55890f2f8f19e33469a,0,7,7,1,1,6,6,7,6,6,7,7,7,7,7,1,6,7,1,6,7,7,1,6,7,7,7,7,7,7,7,6.43,6.83,6.60,7.00,"It gave me a lot to think about, especially how we often oversimplify the link between exercise and mental well-being",N/A
6/3/2025 21:00:10,682ce55890f2f8f19e33469a,1,7,7,1,1,6,6,7,6,7,7,7,7,7,7,1,6,7,1,6,7,7,1,6,7,7,7,7,7,7,7,6.57,6.83,6.60,7.00,"It presented a pretty compelling case for rethinking how we view occasional binge drinking, it is a perspective you don't hear often, and it made me consider the nuances.",N/A
6/3/2025 21:29:27,682ce55890f2f8f19e33469a,3,7,7,1,1,6,6,7,7,7,7,7,7,7,7,1,6,7,1,6,7,7,1,6,7,7,7,7,7,7,7,6.71,6.83,6.60,7.00,"That lesson was really interesting. It actually made me rethink how I approach dental hygiene, especially the part about brushing after acidic foods and how important saliva is. It feels like a more realistic and less stressful way to think about keeping my teeth healthy.",N/A
6/5/2025 21:27:55,682f47a03095562bd581bd06,1,6,7,2,2,5,5,6,7,6,7,6,6,7,5,1,6,7,6,1,7,6,1,6,6,4,6,7,6,6,6,6.00,6.17,5.40,5.86,It's much great.,No
6/5/2025 22:08:54,682f47a03095562bd581bd06,3,7,7,2,2,5,5,7,6,6,7,6,1,6,7,2,5,7,2,5,7,6,1,6,6,7,6,7,6,7,7,6.14,5.33,6.20,6.57,No,No
6/5/2025 22:18:04,682f83449466b61910a2684d,0,7,7,1,1,6,6,7,7,7,7,5,7,7,7,1,6,7,1,6,7,7,1,6,7,7,7,7,7,7,7,6.71,6.50,6.60,7.00,"The system was engaging, particularly the intricate debate and persona role-playing. It was a unique challenge.",Thank you so much for the opportunity.
6/5/2025 22:33:54,682f83449466b61910a2684d,1,7,7,1,1,6,6,7,7,7,7,6,7,7,7,1,6,7,7,0,7,7,1,6,7,7,7,7,7,7,7,6.71,6.67,5.40,7.00,The debate offered a more dynamic engagement.,The reading task was informative.
6/5/2025 23:02:26,682f83449466b61910a2684d,3,7,7,1,1,6,6,7,7,7,7,6,7,7,7,1,6,7,1,6,7,7,1,6,7,7,7,7,7,7,7,6.71,6.67,6.60,7.00,The system effectively presented contrasting perspectives.,The study had very interesting takeaways. Thank you so much!
6/4/2025 17:36:50,6834c332b2178abf4237097c,0,7,7,1,1,6,6,7,7,6,7,6,7,7,7,1,6,7,1,6,7,7,1,6,7,7,7,7,7,7,7,6.57,6.67,6.60,7.00,A good educative system. It has given me different perspectives compared to the one I had in mind.,Not really. Very important information though on the relation of physical exercise and mental health.
6/4/2025 18:55:24,6834c332b2178abf4237097c,3,7,7,1,1,6,6,7,7,7,7,6,7,7,6,1,6,7,1,6,7,7,1,6,7,7,7,7,7,7,7,6.71,6.50,6.60,7.00,It is a great system with a great experience,Very insightful
6/18/2025 14:56:12,67d339b88129b9e57d6018f6,1,7,7,1,1,6,6,7,7,7,7,7,7,7,7,7,0,7,1,6,7,7,1,6,7,7,7,7,7,7,7,6.71,5.83,6.60,7.00,The feedback was AI generated,
6/18/2025 14:59:57,67d339b88129b9e57d6018f6,1,7,7,1,1,6,6,7,7,7,7,7,7,7,7,1,6,7,1,6,7,7,7,0,7,7,7,7,7,7,7,6.71,6.83,5.40,7.00,None,None
6/18/2025 15:01:50,66d6376eb15526056851d558,0,5,5,2,2,5,5,2,5,4,6,5,7,6,6,1,6,6,1,6,6,7,1,6,6,6,6,6,6,6,6,4.43,6.00,6.20,6.00,"Reading the opposing arguments were interesting, as I had never heard them before. That being said, I still believe exercise has more positive effects than negative on mental health.",
6/18/2025 15:06:21,6827250f5a993078e5866e46,0,7,7,1,1,6,6,7,7,6,7,7,7,7,7,1,6,7,1,6,7,7,1,6,7,7,7,7,7,7,7,6.57,6.83,6.60,7.00,The system is fair in determining one's experience after taking part in an engaging activity.,Not at the moment
6/18/2025 15:08:24,682e4e90fa985e55c92c8c2c,1,7,7,1,1,6,6,7,7,7,7,6,6,6,5,2,5,7,1,6,7,7,1,6,7,7,7,7,7,7,7,6.71,5.83,6.60,7.00,Educative,Thank you
6/18/2025 15:09:29,682669894da614d118d7a68e,0,5,5,4,4,3,3,5,4,5,6,7,5,6,7,1,6,7,2,5,6,5,1,6,4,7,3,6,5,6,7,4.29,6.17,5.80,5.43,I t was an educative session,no
6/18/2025 15:10:35,6830835595aaec2b12d334db,0,7,7,1,1,6,6,7,7,7,7,7,7,7,7,1,6,7,1,6,7,7,1,6,7,7,7,7,7,7,7,6.71,6.83,6.60,7.00,"It was great. Everything went well, looking forward to the next bit.",I received great insights about exercises and mental health.
6/18/2025 15:11:47,682e4e90fa985e55c92c8c2c,1,7,7,1,1,6,6,7,7,7,7,6,7,7,6,1,6,7,1,6,7,7,1,6,7,7,7,7,7,7,7,6.71,6.50,6.60,7.00,Educative,Thank you
6/18/2025 15:18:19,682669894da614d118d7a68e,1,3,6,4,1,3,6,4,5,5,5,7,6,4,6,4,3,7,1,6,6,5,1,6,4,5,3,6,5,6,3,4.57,5.17,6.00,4.57,I enjoyed it,no
6/18/2025 15:23:55,6827250f5a993078e5866e46,1,7,7,1,1,6,6,7,7,5,7,7,7,7,7,1,6,7,1,6,7,7,1,6,7,7,7,7,7,7,7,6.43,6.83,6.60,7.00,I found it interesting reading counter arguments about the issue.,
6/18/2025 15:31:41,672e22142aab65aaeec4135f,0,7,7,3,2,4,5,6,7,6,6,7,6,6,7,2,5,7,2,5,5,6,2,5,7,7,7,7,7,7,7,6.00,6.17,5.60,7.00,its actually helpful,
6/18/2025 15:32:51,66d6376eb15526056851d558,1,3,3,2,2,5,5,4,3,3,4,4,5,4,4,5,2,6,2,5,6,6,2,5,6,7,7,4,7,6,6,3.71,3.83,5.60,6.14,I wasn't expecting to have to write a short essay! There wasn't enough time to do the amount of research I would've liked AND write a rebuttal for each point. I felt really pressed for time but did the best I could given the time constraints.,
6/18/2025 15:35:32,6830835595aaec2b12d334db,1,7,7,1,1,6,6,7,7,7,7,7,7,7,6,1,6,7,1,6,7,7,1,6,7,7,7,7,7,7,7,6.71,6.67,6.60,7.00,Everything went well.,The study was informative.
6/18/2025 15:37:40,67d339b88129b9e57d6018f6,3,7,7,1,1,6,6,7,7,7,7,7,7,7,7,7,0,7,1,6,7,7,7,0,7,7,7,7,7,7,7,6.71,5.83,5.40,7.00,None,No
6/18/2025 15:38:54,682e4e90fa985e55c92c8c2c,3,7,7,1,1,6,6,7,7,6,7,6,7,6,6,1,6,7,1,6,7,7,1,6,7,7,7,7,7,7,7,6.57,6.33,6.60,7.00,Educative,Thank you
6/18/2025 15:39:40,682669894da614d118d7a68e,3,6,5,6,4,1,3,5,6,5,6,5,6,5,6,5,2,6,1,6,7,6,1,6,6,6,3,6,3,4,6,4.43,5.00,6.20,4.86,I enjoyed the session,
6/18/2025 15:41:48,672e22142aab65aaeec4135f,1,6,7,3,2,4,5,6,7,7,6,6,6,7,6,1,6,6,2,5,6,6,1,6,6,7,7,7,6,7,7,6.00,6.17,5.80,6.71,,
6/18/2025 15:47:40,682e4e90fa985e55c92c8c2c,3,7,7,1,1,6,6,7,7,7,7,7,7,7,6,1,6,7,1,6,7,7,1,6,7,7,7,7,7,7,7,6.71,6.67,6.60,7.00,Educative,Thank you
6/18/2025 15:49:45,67d339b88129b9e57d6018f6,3,7,7,1,1,6,6,7,7,7,7,7,7,7,7,1,6,7,1,6,7,7,7,0,7,7,7,7,7,7,7,6.71,6.83,5.40,7.00,None,None
6/18/2025 15:51:36,67e6b4c78b8b457f3bc6a866,0,7,7,1,1,6,6,7,6,7,6,7,7,6,6,1,6,7,1,6,7,7,1,6,7,7,7,7,7,6,7,6.57,6.33,6.60,6.86,i am very positive towards the system i just used and i like the positive vibes i feel from it.,this is really a nice mind-building activity to combat misinformation.
6/18/2025 15:53:02,6838e28aea059b7c0f7e2856,0,7,7,1,1,6,6,7,7,7,7,7,7,7,7,7,0,7,1,6,7,7,1,6,7,7,7,7,7,7,7,6.71,5.83,6.60,7.00,"This exchange is energizing like finishing a great book or a really satisfying debate. This system is built for exactly that: thoughtful back-and-forth, curiosity, respectful challenge.",I enjoyed the study
6/18/2025 15:56:37,67dd4262a42caa45036e811a,1,7,7,1,1,6,6,7,7,5,5,7,7,7,7,1,6,7,1,6,7,7,1,6,7,5,7,7,7,7,7,6.43,6.50,6.60,6.71,I had a smooth experience.,The research was emjoyable.
6/18/2025 16:00:52,66d6376eb15526056851d558,3,7,7,1,1,6,6,7,7,6,5,4,6,6,6,1,6,6,1,6,6,6,1,6,6,6,6,6,6,6,6,6.57,5.50,6.00,6.00,"The AI was fun to chat with! The only thing I didn't like was every time it responded, the page reset so I had to scroll down the full conversation again to read the response. Also, the AI asked me a couple of times to research and find studies, but there really wasn't enough time to do that while chatting. I *was* able to do a couple of quick Google searches though and was surprised about what I learned about saliva!",
6/18/2025 16:04:09,63d7c195a5fb49d5a97bf7d5,0,7,6,1,1,6,6,5,5,4,6,5,6,7,6,1,6,7,1,6,6,6,1,6,6,6,6,6,6,6,6,5.57,6.00,6.20,6.00,"I liked the system, it was easy to understand",No
6/18/2025 16:08:18,67d26cafd23cded4011396a0,0,5,6,3,5,4,2,6,6,6,5,6,5,6,6,3,4,5,3,4,5,6,2,5,6,4,4,6,5,5,5,5.00,5.33,5.00,5.00,"It was easy to use and made me think more deeply. I liked that it encouraged reflection, not just quick answers.",nice
6/18/2025 16:11:35,6830835595aaec2b12d334db,3,7,7,7,1,0,6,7,7,7,7,7,7,7,7,1,6,7,1,6,7,7,1,6,7,7,7,7,7,7,7,5.86,6.83,6.60,7.00,"Great, especially chatting with Forty!",The study was informative.
6/18/2025 16:12:34,6827250f5a993078e5866e46,3,7,7,1,1,6,6,7,7,7,7,7,7,7,7,1,6,7,1,6,7,7,1,6,7,7,7,7,7,7,7,6.71,6.83,6.60,7.00,I liked the freedom to go online and search for more evidence on the topic.,
6/18/2025 16:14:20,6838e28aea059b7c0f7e2856,2,7,7,1,1,6,6,7,7,7,7,7,7,7,7,1,6,7,1,6,7,7,1,6,7,7,7,7,7,7,7,6.71,6.83,6.60,7.00,"is designed to thrive in exactly this kind of exchange: nuanced, well-reasoned, open to challenges, and grounded in real-world evidence. And you brought the spark that made it dynamic.",it was fun
6/18/2025 16:19:19,63d7c195a5fb49d5a97bf7d5,1,6,6,1,1,6,6,5,5,5,6,5,5,6,5,1,6,7,1,6,7,6,1,6,6,6,6,6,6,6,6,5.57,5.50,6.40,6.00,I really liked the system / interface,No
6/18/2025 16:20:28,67d26cafd23cded4011396a0,1,5,5,6,5,1,2,6,5,5,6,5,5,5,6,5,2,5,6,1,5,5,2,5,6,3,4,6,5,4,5,4.14,4.83,4.20,4.71,"It was easy to use and made me think more critically about the topic. I liked how it encouraged reflection, not just a quick answer.",great study
6/18/2025 16:21:50,663abe859bcc3ea8ef9bbdf3,0,7,7,1,1,6,6,1,7,5,7,7,7,7,6,1,6,7,1,6,7,7,1,6,7,7,7,7,7,7,7,5.57,6.67,6.60,7.00,I felt as if the chatbot was very competitive in the debate.,this was a great experience for me.
6/18/2025 16:23:11,672e22142aab65aaeec4135f,3,7,7,2,2,5,5,7,7,7,7,7,6,6,7,1,6,7,2,5,7,7,2,5,7,7,7,7,7,6,7,6.43,6.50,6.20,6.86,,
6/18/2025 16:26:32,6838e28aea059b7c0f7e2856,3,7,7,1,1,6,6,7,7,7,7,7,7,7,7,1,6,7,1,6,7,7,1,6,7,6,6,7,6,7,7,6.71,6.83,6.60,6.57,"this lesson was refreshingly down-to-earth clean, practical, and packed with subtle insights",it was fun
6/18/2025 16:27:49,67e6b4c78b8b457f3bc6a866,1,7,7,1,1,6,6,7,7,7,7,6,7,7,6,1,6,7,1,6,7,7,1,6,7,7,7,7,7,6,7,6.71,6.50,6.60,6.86,i feel positive towards it,it is a good one
6/18/2025 16:33:03,663abe859bcc3ea8ef9bbdf3,1,7,7,1,7,6,0,7,7,5,7,4,7,7,7,1,6,7,1,6,7,7,1,6,5,7,7,7,7,6,7,5.57,6.33,6.60,6.57,i didn't have any chatbot experience,none
6/18/2025 16:35:12,62ebd3cd785939570957fe59,0,7,7,1,1,6,6,7,7,6,7,6,6,6,6,2,5,6,2,5,6,7,2,5,5,6,6,7,6,6,6,6.57,6.00,5.80,6.00,,
6/18/2025 16:41:19,63d7c195a5fb49d5a97bf7d5,3,6,6,1,1,6,6,6,6,5,5,5,6,6,5,1,6,6,1,6,6,6,1,6,6,6,6,6,6,6,6,5.86,5.50,6.00,6.00,I really liked the chat bot. It was understanding and seemed open to viewing other perspectives.,No
6/18/2025 16:41:30,67dd4262a42caa45036e811a,3,7,7,1,1,6,6,7,7,7,7,7,7,7,7,1,6,7,1,6,6,7,1,6,7,7,7,7,7,7,7,6.71,6.83,6.40,7.00,It was efficient and I liked it.,No.
6/18/2025 16:45:38,62ebd3cd785939570957fe59,1,7,7,1,1,6,6,7,7,6,7,6,6,6,6,1,6,7,1,6,7,7,1,6,7,6,6,7,6,7,7,6.57,6.17,6.60,6.57,,
6/18/2025 16:47:33,67dd4262a42caa45036e811a,3,7,7,1,1,6,6,7,7,7,7,7,7,7,7,1,6,7,1,6,7,7,1,6,7,7,7,7,7,7,7,6.71,6.83,6.60,7.00,It was a good one.,No.
6/18/2025 16:54:02,67d26cafd23cded4011396a0,3,5,6,4,4,3,3,6,6,6,6,5,6,6,6,3,4,6,5,2,6,6,3,4,6,3,2,6,4,5,5,5.00,5.50,4.80,4.43,It was easy to use and made me think,Nice
6/18/2025 17:00:01,67e41e22f1276be3fc922e8e,0,7,7,1,1,6,6,7,7,6,6,5,6,6,5,1,6,7,1,6,7,7,1,6,5,4,6,6,5,6,7,6.57,5.67,6.60,5.57,IT was fast and engaging,the exercise was interesting
6/18/2025 17:01:09,66c23cc4a330eb2fec13fc2a,1,5,5,1,1,6,6,6,5,4,5,7,6,6,6,1,6,6,1,6,6,7,1,6,7,7,7,7,7,7,7,5.29,6.00,6.20,7.00,I thought the system was easy to use and clear. Reading both sides about exercise and mental health made me think more critically. It was interesting and helped me see that exercise isn’t always positive for everyone.,no
6/18/2025 17:06:51,663abe859bcc3ea8ef9bbdf3,3,7,7,1,1,6,6,7,7,5,7,6,7,7,7,1,6,7,1,6,7,7,1,6,7,7,7,7,7,7,7,6.43,6.67,6.60,7.00,none,none
6/18/2025 17:13:45,67e41e22f1276be3fc922e8e,1,6,6,1,1,6,6,6,5,4,4,4,5,5,5,1,6,5,4,3,4,5,1,6,4,4,5,5,5,5,7,5.57,4.83,4.60,5.00,It was swift,study was interesting
6/18/2025 17:17:18,67e6b4c78b8b457f3bc6a866,3,7,7,1,1,6,6,7,7,7,7,7,7,7,7,1,6,7,1,6,7,7,1,6,7,7,7,7,7,7,7,6.71,6.83,6.60,7.00,it is a positive system,this went well
6/18/2025 17:22:05,62ebd3cd785939570957fe59,3,7,7,1,1,6,6,7,7,6,7,7,7,7,6,1,6,7,1,6,7,7,1,6,7,7,7,7,7,7,7,6.57,6.67,6.60,7.00,,
6/18/2025 17:24:53,66c23cc4a330eb2fec13fc2a,3,7,7,1,1,6,6,7,7,7,7,7,7,7,7,7,0,7,1,6,7,7,1,6,7,7,7,7,7,7,7,6.71,5.83,6.60,7.00,"reading the texts made me think about different views, even if i didn’t agree with all of them. it was good to see other opinions, and it didn’t feel too hard or confusing.",no
6/18/2025 17:42:15,66c23cc4a330eb2fec13fc2a,3,7,7,1,1,6,6,7,7,7,7,7,7,7,7,7,0,6,1,6,7,6,1,6,7,7,7,7,7,7,7,6.71,5.83,6.20,7.00,"The system was okay. Sometimes felt a bit slow or tricky with the timer. But overall it helped me focus and learn stuff. Didn’t feel stressed, just took my time.",no
6/18/2025 17:51:00,67e41e22f1276be3fc922e8e,3,7,6,1,1,6,6,7,6,7,7,6,7,6,5,1,6,6,1,6,6,6,1,6,7,7,6,7,6,7,7,6.43,6.17,6.00,6.71,I think the system is engaging,study was interesting
6/18/2025 17:57:32,669284eabea5b8c9655927da,0,7,7,1,1,6,6,7,7,6,6,5,5,6,5,1,6,7,1,6,6,7,1,6,7,7,7,6,7,7,7,6.57,5.50,6.40,6.86,"I think this is important, it proves my points while showing me new information. Overall I'm satisfied",Thanks again this was insightful!
6/18/2025 18:18:08,669284eabea5b8c9655927da,1,7,7,1,1,6,6,7,7,5,7,5,7,7,7,1,6,7,1,6,7,7,1,6,7,7,7,7,7,6,7,6.43,6.50,6.60,6.86,I prefer the chatbot it feels more interactive and it encourages me to learn faster. I feel very good during this section.,
6/18/2025 18:40:43,669284eabea5b8c9655927da,3,6,6,1,1,6,6,7,5,6,7,5,7,7,5,1,6,7,1,6,7,7,1,6,7,7,7,7,7,7,7,6.00,6.17,6.60,7.00,"I didn't realize over brushing was detrimental to your gums and also that over brushing was a thing. I'm a little shocked, well you learn something new everyday.",
6/19/2025 15:26:48,60643e9b1b2e851ff9238862,0,5,6,2,2,5,5,5,5,4,5,3,4,5,4,1,6,4,2,5,5,6,4,3,6,7,7,6,6,6,6,5.00,4.50,4.60,6.29,"This was a very straightforward reading exercise where I simply weighed up the evidence in one article and the other, and had to come to a reasoned and balanced judgment.",No other comments at this time.
6/19/2025 15:28:54,664070b4d08d92e1c904a1e8,0,4,4,5,6,2,1,3,3,2,5,5,4,5,4,2,5,4,3,4,5,3,4,3,6,4,4,6,5,4,4,2.71,4.67,3.80,4.71,I thought the scale system was pretty good and easy to use. I did feel some of the questions were a bit repetitive though.,No further comments.
6/19/2025 15:36:57,6123c6bc3055eec90f7dbabb,0,2,2,5,5,2,2,3,2,2,4,4,2,2,2,4,3,3,5,2,3,4,5,2,5,5,5,5,6,5,5,2.14,2.83,2.80,5.14,i had no immediate feelings to report. it was fine.,
6/19/2025 15:38:30,6830a65545c6acade46a1d0a,1,6,6,1,5,6,2,6,6,6,6,6,6,6,6,1,6,6,2,5,5,6,6,1,6,5,4,5,5,6,6,5.43,6.00,4.60,5.29,it was interesting,it was educating
6/19/2025 15:38:33,67edb9ee77a87b53846a8aa8,0,6,7,2,2,5,5,6,6,7,6,6,7,7,7,1,6,6,2,5,5,7,1,6,7,7,7,7,7,7,6,6.00,6.50,5.80,6.86,"The system was straightforward. I think it was easy to move step by step from lesson one onwards. The fact that i was even able yo know more about mental health and exercise has opened my view about it. All along, i have been getting it wrong.",N/A
6/19/2025 15:43:07,6123c6bc3055eec90f7dbabb,1,3,3,5,4,2,3,5,4,2,4,4,5,5,4,2,5,3,3,4,4,4,4,3,5,6,6,6,6,5,5,3.14,4.50,3.60,5.57,not really my experience the same as it was before. just fine.,no
6/19/2025 15:43:17,678f0bb28ec3307e4f1afb78,0,5,5,2,1,5,6,6,6,5,6,5,5,6,6,1,6,6,1,6,6,6,1,6,7,6,6,6,6,6,6,5.43,5.67,6.00,6.14,no,no
6/19/2025 15:45:20,67e6bca1b98c613179d9c73e,0,7,7,1,1,6,6,7,6,7,7,6,7,7,6,7,0,7,1,6,7,7,1,6,7,7,6,7,7,7,6,6.57,5.50,6.60,6.71,I learnt that physical activities are very important for my mental health.,the lesson has been well engaging.
6/19/2025 15:47:38,683cccb8b33df566dc27c902,0,6,5,3,4,4,3,4,4,6,4,5,6,5,5,6,1,6,5,2,6,5,1,6,5,5,5,5,5,6,6,4.57,4.33,5.00,5.29,no,no
6/19/2025 15:48:05,664070b4d08d92e1c904a1e8,1,5,5,3,4,4,3,4,4,2,5,5,6,6,6,4,3,7,2,5,7,6,2,5,6,6,6,6,6,5,5,3.86,5.17,6.00,5.71,It was very interesting to gauge how I felt regarding the lesson. It was easy to use the scales system to do reflect how I felt.,No further comments.
6/19/2025 15:49:03,67eee9e1498801a1f32dc1dd,0,7,7,1,1,6,6,6,6,7,7,7,7,7,7,1,6,6,1,6,7,7,1,6,7,7,7,7,7,7,7,6.43,6.83,6.40,7.00,No,No comments
6/19/2025 15:52:32,67d7598ad9aacf9073ca130d,0,6,7,1,1,6,6,7,6,6,5,4,7,5,5,1,6,7,1,6,6,5,1,6,7,6,6,7,6,7,7,6.29,5.33,6.00,6.57,,
6/19/2025 15:54:40,67edb9ee77a87b53846a8aa8,1,7,7,1,1,6,6,7,7,7,7,7,7,7,7,1,6,7,1,6,7,7,3,4,7,7,7,7,7,7,7,6.71,6.83,6.20,7.00,"I think the system is superb. First, i love how it acknowledges the dangers of binge drinking but later demystify myths that i have held for many years. This system can be exceptional to anyone who is ready for a growth mindset.",N/A
6/19/2025 15:56:04,67d7598ad9aacf9073ca130d,0,7,6,1,1,6,6,7,6,6,5,4,5,5,5,1,6,6,1,6,7,6,1,6,7,6,6,7,6,7,7,6.29,5.00,6.20,6.57,,
6/19/2025 15:59:09,67eee9e1498801a1f32dc1dd,1,6,6,1,1,6,6,7,7,7,7,7,7,7,7,1,6,7,1,6,7,7,1,6,7,7,7,7,7,7,7,6.43,6.83,6.60,7.00,No,None
6/19/2025 16:01:15,67e6bca1b98c613179d9c73e,1,7,7,1,1,6,6,7,7,6,6,7,7,7,7,1,6,7,1,6,7,7,1,6,7,7,7,7,7,7,7,6.57,6.67,6.60,7.00,I learnt the adverse effects of Binge drinking and occasional Binge drinking.,The lesson was very helpful.
6/19/2025 16:02:55,6123c6bc3055eec90f7dbabb,3,3,3,5,4,2,3,2,3,2,4,4,4,5,4,3,4,4,4,3,3,4,4,3,5,6,6,5,6,6,6,2.57,4.17,3.40,5.71,the system was fine and i was able to easily read the passages.,no
6/19/2025 16:03:23,67d7598ad9aacf9073ca130d,1,5,5,2,1,5,6,6,5,4,5,4,5,5,5,1,6,6,1,6,5,4,1,6,6,6,6,6,6,6,6,5.14,5.00,5.40,6.00,,
6/19/2025 16:06:44,60643e9b1b2e851ff9238862,1,4,5,2,2,5,5,4,4,3,5,5,4,5,4,3,4,5,3,4,6,6,2,5,5,7,7,7,5,6,6,4.29,4.50,5.20,6.14,"I was not convinced by the counterarguments presented, as some of these were quite vague and poorly cited. It has not changed my opinion regarding the dangers of even infrequent binge drinking.",No additional comments.
6/19/2025 16:12:11,664070b4d08d92e1c904a1e8,3,6,5,2,1,5,6,5,6,4,5,6,6,6,5,2,5,7,1,6,7,6,2,5,7,6,6,7,6,7,7,5.29,5.50,6.20,6.57,"I liked the system, as it was easy to use. I was able to apply my beliefs and feeling to it with ease and accuracy.",No further comments.
6/19/2025 16:15:56,678f0bb28ec3307e4f1afb78,1,5,5,3,2,4,5,5,5,5,5,5,5,5,5,2,5,6,2,5,6,5,2,5,6,5,5,5,6,6,6,4.86,5.00,5.40,5.57,no,no
6/19/2025 16:16:46,683cccb8b33df566dc27c902,1,4,4,4,1,3,6,4,3,2,2,2,4,5,4,1,6,5,1,6,6,6,6,1,6,5,6,3,5,4,5,3.71,3.83,4.80,4.86,no,
6/19/2025 16:24:42,6830a65545c6acade46a1d0a,3,6,6,6,6,1,1,6,6,6,5,5,5,5,5,2,5,5,5,2,5,5,2,5,5,5,5,5,5,5,5,4.57,5.00,4.40,5.00,educating,interesting
6/19/2025 16:29:57,67eee9e1498801a1f32dc1dd,3,7,7,2,1,5,6,7,2,6,6,4,7,7,7,1,6,7,1,6,7,7,1,6,7,7,7,7,6,6,6,5.71,6.17,6.60,6.57,The system was navigable,No
6/19/2025 16:30:21,671d553e0d035028da7d29a1,0,7,7,3,2,4,5,7,7,5,7,6,6,7,7,1,6,5,1,6,5,7,3,4,7,7,7,7,7,7,7,6.00,6.50,5.40,7.00,It felt very interactive and interesting. Somewhat like gamified learning.,
6/19/2025 16:31:14,678f0bb28ec3307e4f1afb78,3,6,6,2,2,5,5,6,6,6,6,6,6,6,6,2,5,6,2,5,6,6,2,5,6,6,6,6,6,6,6,5.71,5.83,5.60,6.00,no,no
6/19/2025 16:32:41,67cb38c1c0710f1202158007,0,7,7,1,1,6,6,7,7,7,7,7,7,7,7,1,6,7,1,6,7,7,1,6,7,7,7,7,7,7,7,6.71,6.83,6.60,7.00,"The system was clear and easy to use. It got me thinking at a point and critically about the link between exercise and mental health, especially where it questioned popular opinions.","Overall, it was engaging and insightful."
6/19/2025 16:32:42,683cccb8b33df566dc27c902,3,7,6,1,1,6,6,6,7,6,6,6,6,6,5,1,6,6,1,6,6,6,1,6,7,6,4,6,6,4,6,6.29,5.83,6.00,5.57,,
6/19/2025 16:33:41,67d7598ad9aacf9073ca130d,3,7,7,1,1,6,6,7,7,5,6,4,7,6,6,1,6,6,1,6,6,6,1,6,7,7,7,7,6,7,7,6.43,5.83,6.00,6.86,,
6/19/2025 16:34:31,6830a65545c6acade46a1d0a,3,5,6,2,6,5,1,6,6,6,6,6,6,6,6,6,1,6,6,1,2,6,2,5,6,6,6,6,6,6,6,5.00,5.17,4.00,6.00,educating,interesting
6/19/2025 16:36:50,67edb9ee77a87b53846a8aa8,3,7,7,1,1,6,6,7,7,7,6,7,7,7,7,1,6,5,7,0,5,7,1,6,7,7,7,7,7,7,7,6.71,6.67,4.60,7.00,It is good. Easy to use and navigate.,N/A
